{
  "schema_version": "0.1",
  "semantic_program_hash": "sha256:beac8904db84998c56eca183c0e979f99746da2cec916f58c600416ee5de3cbf",
  "registry_snapshot_id": "sha256:5b1e89c974f35a0f3e1e7040bbec8f2e44ea908eb9a12d313ecda40600c6ddbd",
  "effects": ["ARTIFACT_READ", "ARTIFACT_WRITE"],
  "authority_classes": ["artifact.read", "artifact.write"],
  "egress_modes": ["deny"],
  "contains_probabilistic": true,
  "contains_opaque_external": false,
  "nodes": [
    {
      "node_id": "compose_report",
      "capability": "document.compose@1",
      "execution_class": "deterministic",
      "effects": ["ARTIFACT_WRITE"],
      "authority_classes": ["artifact.write"],
      "egress_mode": "deny",
      "verification_gate": false
    },
    {
      "node_id": "compute_metrics",
      "capability": "stats.compare_periods@1",
      "execution_class": "deterministic",
      "effects": ["PURE"],
      "authority_classes": [],
      "egress_mode": "deny",
      "verification_gate": false
    },
    {
      "node_id": "draft_narrative",
      "capability": "report.summarize@1",
      "execution_class": "probabilistic",
      "effects": ["PURE"],
      "authority_classes": [],
      "egress_mode": "deny",
      "verification_gate": false
    },
    {
      "node_id": "import_table",
      "capability": "table.import@1",
      "execution_class": "deterministic",
      "effects": ["ARTIFACT_READ"],
      "authority_classes": ["artifact.read"],
      "egress_mode": "deny",
      "verification_gate": false
    },
    {
      "node_id": "normalize_table",
      "capability": "table.normalize@1",
      "execution_class": "deterministic",
      "effects": ["PURE"],
      "authority_classes": [],
      "egress_mode": "deny",
      "verification_gate": false
    },
    {
      "node_id": "render_chart",
      "capability": "chart.render@1",
      "execution_class": "deterministic",
      "effects": ["ARTIFACT_WRITE"],
      "authority_classes": ["artifact.write"],
      "egress_mode": "deny",
      "verification_gate": false
    },
    {
      "node_id": "verify_narrative",
      "capability": "verify.numeric_claims@1",
      "execution_class": "deterministic",
      "effects": ["PURE"],
      "authority_classes": [],
      "egress_mode": "deny",
      "verification_gate": true
    }
  ],
  "verification_barriers": ["verify_narrative"],
  "generated_by": {
    "id": "org.ainative.aios-ir-validator",
    "version": "0.1.0"
  },
  "generated_at": "2026-09-15T00:00:00Z"
}
